{
  "$schema": "./features.schema.json",
  "version": "5.27.0",
  "tagline": "Rules, multi-session memory, templates, and a reviewed multi-agent chain for AI coding CLIs",
  "subtitle": "Project learnings persist under .hyperflow/memory/. Doctrine auto-routes work. Task templates decompose. Workers build; specialists review via host orchestration with inline fallbacks when subagents are unavailable. Issue to PR when that is the job. Codex CLI is preview; desktop App support pending certification.",
  "layers": [
    {
      "n": 0,
      "name": "Project Analysis",
      "summary": "Cache tech stack and conventions in .hyperflow/",
      "color": "user"
    },
    {
      "n": "0.5",
      "name": "Task Triage",
      "summary": "Run deterministic inline-fast preflight first; otherwise classify types, complexity, risk, ambiguity, flow, and personas before workers fire",
      "color": "thinking"
    },
    {
      "n": 1,
      "name": "Autonomy",
      "summary": "Lean context by default, zero invented questions for grounded clear work, minimal output, silent recovery",
      "color": "thinking"
    },
    {
      "n": 2,
      "name": "Role Dispatch",
      "summary": "Every agent runs on the current session model; roles differ by responsibility, not model.",
      "color": "thinking"
    },
    {
      "n": 3,
      "name": "Orchestrator",
      "summary": "Proven safe 1\u20132-file work runs inline-fast; everything else decomposes \u2192 dispatches \u2192 reviews \u2192 synthesizes",
      "color": "worker"
    },
    {
      "n": 4,
      "name": "Brainstorming",
      "summary": "Design exploration + approval before implementation",
      "color": "thinking"
    },
    {
      "n": 5,
      "name": "Quality Gates",
      "summary": "Automated lint/typecheck/tests after every review",
      "color": "worker"
    },
    {
      "n": 6,
      "name": "Project Memory",
      "summary": "Persistent learnings in .hyperflow/memory/ (project-scoped, tagged, tiered)",
      "color": "memory"
    },
    {
      "n": 7,
      "name": "Task Templates",
      "summary": "Pre-built decomposition: CRUD, API, UI, migration, refactor, debug",
      "color": "worker"
    },
    {
      "n": 8,
      "name": "Git Workflow",
      "summary": "Auto-branch creation, auto-commit after approval",
      "color": "git"
    },
    {
      "n": 9,
      "name": "Security",
      "summary": "Prompt-injected blocklists for worker containment",
      "color": "security"
    }
  ],
  "skills": [
    {
      "name": "scaffold",
      "command": "/hyperflow:scaffold",
      "tagline": "Project setup",
      "purpose": "Analyze project, create .hyperflow/ cache, install multi-tool shims",
      "chain": "standalone"
    },
    {
      "name": "plan",
      "command": "/hyperflow:plan",
      "tagline": "Design + decompose",
      "purpose": "Amplify the prompt, ask only material questions, design the approach, and decompose into a batched task file \u2014 grounded clear work invents zero questions; stops at a build-location gate, never auto-implements",
      "chain": "starter"
    },
    {
      "name": "issue",
      "command": "/hyperflow:issue",
      "tagline": "Issue \u2192 PR",
      "purpose": "Turn a GitHub issue into a triaged, planned, dispatched, and reviewed pull request \u2014 bug reports route through root-cause discipline, features through the plan chain; every outbound action gated",
      "chain": "starter"
    },
    {
      "name": "dispatch",
      "command": "/hyperflow:dispatch",
      "tagline": "Execute the batches",
      "purpose": "Use deterministic foreground inline-fast only for observed clear reversible 1\u20132-file work; otherwise orchestrate workers with Worker \u2192 Reviewer review (host parallel tool calls when available; labelled inline phases as fallback) + final integration review",
      "chain": "endpoint"
    },
    {
      "name": "workflow",
      "command": "/hyperflow:workflow",
      "tagline": "Big-task workflow lane",
      "purpose": "Use Claude Code native workflows or the Codex/OpenCode portable adapter for system-wide work, large migrations, repo-wide audits, and high-confidence verification",
      "chain": "standalone"
    },
    {
      "name": "trace",
      "command": "/hyperflow:trace",
      "tagline": "Root-cause a bug",
      "purpose": "Systematic 5-Whys + hypothesis testing \u2014 never patches symptoms",
      "chain": "standalone"
    },
    {
      "name": "audit",
      "command": "/hyperflow:audit",
      "tagline": "Code review",
      "purpose": "L1 quick \u2192 L5 exhaustive review on changes, files, or PRs",
      "chain": "standalone"
    },
    {
      "name": "pr",
      "command": "/hyperflow:pr",
      "tagline": "PR review",
      "purpose": "Run the L1-L5 audit against an incoming pull request's real diff range, post findings as one batched GitHub review, chain fixes on NEEDS_FIX, and merge behind a gate \u2014 contributor code never executes without explicit consent",
      "chain": "standalone"
    },
    {
      "name": "deploy",
      "command": "/hyperflow:deploy",
      "tagline": "Pre-push gates",
      "purpose": "Lint, typecheck, build, tests, security sweep, commit, release, push (push always asks)",
      "chain": "standalone"
    },
    {
      "name": "cache",
      "command": "/hyperflow:cache",
      "tagline": "Memory CRUD",
      "purpose": "Show, search, add, edit, prune, archive, clear, stats, migrate, off, compact",
      "chain": "standalone"
    },
    {
      "name": "handoff",
      "command": "/hyperflow:handoff",
      "tagline": "Two-session handoff",
      "purpose": "Manage a cross-environment two-session run \u2014 list/status/pickup/review/complete a committed handoff package (plan in one session, build in another, review back in the first)",
      "chain": "standalone"
    },
    {
      "name": "design",
      "command": "/hyperflow:design",
      "tagline": "Systematic UI design",
      "purpose": "Establish/extend the design system, research real-world prior art, dispatch the designer specialist, review for taste + accessibility \u2014 ends with a handoff gate into the chain",
      "chain": "standalone"
    },
    {
      "name": "status",
      "command": "/hyperflow:status",
      "tagline": "Project state snapshot",
      "purpose": "One-screen read-only view \u2014 version, profile freshness, memory count, live progress on every in-flight task",
      "chain": "standalone"
    },
    {
      "name": "background",
      "command": "/hyperflow:background",
      "tagline": "Background agents",
      "purpose": "List, inspect, cancel, and prune background agents fired during prior chain runs",
      "chain": "standalone"
    },
    {
      "name": "sticky",
      "command": "/hyperflow:sticky",
      "tagline": "Auto-routing mode",
      "purpose": "Set auto-routing: on (every task-shaped message routes), auto (intent-verb messages route \u2014 default), off",
      "chain": "standalone"
    },
    {
      "name": "bridge",
      "command": "/hyperflow:bridge",
      "tagline": "Portable doctrine",
      "purpose": "Embed the managed doctrine block into CLAUDE.md so autonomy + intent-routing + commit cadence carry to Desktop, claude.ai web, and IDE extensions",
      "chain": "portability"
    },
    {
      "name": "flush",
      "command": "/hyperflow:flush",
      "tagline": "Flush deferred commits",
      "purpose": "Recover a deferred-commit queue from a prior or interrupted chain \u2014 fast-forward the staging branch, delete staging, clear the queue",
      "chain": "standalone"
    },
    {
      "name": "reap",
      "command": "/hyperflow:reap",
      "tagline": "Post-completion cleanup",
      "purpose": "Archive a finished task's artefact scope, delete ephemeral leftovers, optimise durable memory \u2014 never source code; also the lifecycle phase at dispatch/deploy/handoff termini",
      "chain": "standalone"
    },
    {
      "name": "hyperflow",
      "command": "/hyperflow:hyperflow",
      "tagline": "Single-agent adapter",
      "purpose": "Apply lean-by-default orchestration in Codex, Antigravity, Grok, or another single-agent surface, preserving deterministic safe fast work and the normal reviewed path",
      "chain": "portable single-agent adapter"
    }
  ],
  "specialists": {
    "location": "agents/",
    "router": {
      "name": "brain",
      "tier": "decision-maker",
      "role": "decision-maker",
      "focus": "Selects the responsible specialist roster after triage; decides web-research + fan-out (cheap pass-through on fast/standard flows)"
    },
    "reviewers": [
      {
        "name": "frontend-reviewer",
        "personas": [
          "frontend",
          "ui"
        ],
        "tier": "reviewer"
      },
      {
        "name": "backend-reviewer",
        "personas": [
          "api",
          "architect"
        ],
        "tier": "reviewer"
      },
      {
        "name": "api-reviewer",
        "personas": [
          "api"
        ],
        "tier": "reviewer"
      },
      {
        "name": "database-reviewer",
        "personas": [
          "db"
        ],
        "tier": "reviewer"
      },
      {
        "name": "database-optimization-reviewer",
        "personas": [
          "db",
          "performance"
        ],
        "tier": "reviewer"
      },
      {
        "name": "security-reviewer",
        "personas": [
          "security"
        ],
        "tier": "reviewer"
      },
      {
        "name": "vulnerability-reviewer",
        "personas": [
          "security",
          "scientific"
        ],
        "tier": "reviewer"
      },
      {
        "name": "devops-reviewer",
        "personas": [
          "devops"
        ],
        "tier": "reviewer"
      },
      {
        "name": "performance-reviewer",
        "personas": [
          "performance"
        ],
        "tier": "reviewer"
      },
      {
        "name": "algorithm-reviewer",